{"contract_version":"1.0.0","identity":{"decision_id":"RSK-11111111111111111111111111111111","decision_key":"RDK-9B300D208C0C63CDD7299688B758CDA7947DFCC7425FB648E93F7B1B4CF1A91D","recommendation_id":"REC-11111111111111111111111111111111","recommendation_key":"RCK-B221BE3D3DBC757E9FD394930157F16E2098D539CB244DC70A5899232ED9D33E","run_id":"RUN-11111111111111111111111111111111","task_id":"TSK-11111111111111111111111111111111"},"gate":{"proposed_action":"STOP_LINE","decision":"REQUIRE_APPROVAL","risk_level":"HIGH","approval_required":true,"allowed_actions":["HOLD_BATCH","ESCALATE"],"policy_refs":["policy:risk-v1"],"reason_codes":["STOP_LINE_REQUIRES_APPROVAL"],"confidence":0.95},"generated_at":"2026-08-19T01:00:00Z"}
